{
  "$schema": "https://json-schema.org/draft/2020-12/schema",
  "$id": "https://gjallaros.invalid/oddc/device.schema.json",
  "title": "oddc device manifest",
  "type": "object",
  "additionalProperties": false,
  "required": [
    "schema",
    "id",
    "class",
    "lifecycle",
    "validation"
  ],
  "properties": {
    "schema": {
      "const": 1
    },
    "id": {
      "type": "string",
      "pattern": "^[a-z0-9][a-z0-9._-]*(/[a-z0-9][a-z0-9._-]*)+$"
    },
    "class": {
      "type": "string",
      "minLength": 1
    },
    "vendor": {
      "type": "string"
    },
    "match": {
      "type": "object",
      "additionalProperties": false,
      "properties": {
        "sysVendor": {
          "$ref": "#/$defs/stringList"
        },
        "productName": {
          "$ref": "#/$defs/stringList"
        },
        "productVersion": {
          "$ref": "#/$defs/stringList"
        },
        "boardVendor": {
          "$ref": "#/$defs/stringList"
        },
        "boardName": {
          "$ref": "#/$defs/stringList"
        },
        "boardVersion": {
          "$ref": "#/$defs/stringList"
        }
      }
    },
    "inherits": {
      "type": "array",
      "uniqueItems": true,
      "items": {
        "type": "string",
        "pattern": "^[a-z0-9][a-z0-9._-]*(/[a-z0-9][a-z0-9._-]*)+$"
      }
    },
    "modules": {
      "type": "array",
      "uniqueItems": true,
      "items": {
        "type": "string",
        "minLength": 1
      }
    },
    "lifecycle": {
      "type": "object",
      "additionalProperties": false,
      "required": ["status"],
      "properties": {
        "status": {
          "enum": [
            "supported",
            "experimental",
            "stale",
            "retired"
          ]
        }
      }
    },
    "validation": {
      "type": "object",
      "additionalProperties": false,
      "properties": {
        "lastValidatedNixOS": {
          "type": "string"
        },
        "lastValidatedGjallarOSRevision": {
          "type": "string"
        },
        "lastValidatedDeviceID": {
          "type": "string"
        },
        "lastValidatedODDCRevision": {
          "type": "string"
        },
        "lastValidatedAt": {
          "type": "string"
        }
      }
    }
  },
  "$defs": {
    "stringList": {
      "type": "array",
      "minItems": 1,
      "uniqueItems": true,
      "items": {
        "type": "string",
        "minLength": 1
      }
    }
  }
}
