{
  "schema": 1,
  "id": "laptop/framework/laptop-13/amd/ryzen-7040",
  "class": "laptop",
  "vendor": "Framework",
  "match": {
    "sysVendor": [
      "Framework"
    ],
    "productName": [
      "Laptop 13 (AMD Ryzen 7040Series)"
    ]
  },
  "inherits": [
    "laptop/framework"
  ],
  "modules": [],
  "lifecycle": {
    "status": "experimental"
  },
  "validation": {
    "lastValidatedNixOS": "",
    "lastValidatedGjallarOSRevision": "",
    "lastValidatedAt": ""
  }
}
