{
  "class": "laptop",
  "id": "laptop/common",
  "inherits": [],
  "lifecycle": {
    "status": "supported"
  },
  "modules": [
    "default.nix",
    "modules/battery.nix",
    "modules/boot.nix",
    "modules/fan-control.nix"
  ],
  "schema": 1,
  "validation": {
    "lastValidatedAt": "",
    "lastValidatedGjallarOSRevision": "",
    "lastValidatedNixOS": ""
  }
}
